{
  "schema_version": "pywel.entity.v1",
  "entity_id": "ent_01jzcdfarming000000000001",
  "game_id": "crimson_desert",
  "slug": "system.farming",
  "entity_type": "system",
  "subtype": "system",
  "canonical_name": {
    "locale": "en-US",
    "text": "Farming"
  },
  "summary": "Crimson Desert system reference: Farming. Gameplay support is limited to the linked claims and patch records.",
  "aliases": [],
  "tags": [
    "life-skill",
    "seeds"
  ],
  "provenance": {
    "created_at": "2026-07-14T00:00:00-05:00",
    "created_by": "seed_import_v1",
    "source_receipt_id": "rcp_m1publicscope202609100001"
  }
}
