{
  "schema_version": "pywel.entity.v1",
  "entity_id": "ent_01jzcdmagicscythe00000001",
  "game_id": "crimson_desert",
  "slug": "item.magic-scythe",
  "entity_type": "item",
  "subtype": "tool",
  "canonical_name": {
    "locale": "en-US",
    "text": "Magic Scythe"
  },
  "summary": "Crimson Desert item reference: Magic Scythe. Gameplay support is limited to the linked claims and patch records.",
  "aliases": [],
  "tags": [
    "farming",
    "tool"
  ],
  "provenance": {
    "created_at": "2026-07-14T00:00:00-05:00",
    "created_by": "seed_import_v1",
    "source_receipt_id": "rcp_m1publicscope202609100001"
  }
}
