{
  "schema_version": "pywel.entity.v1",
  "entity_id": "ent_01jzcdcontrols00000000001",
  "game_id": "crimson_desert",
  "slug": "system.controller-remapping",
  "entity_type": "system",
  "subtype": "system",
  "canonical_name": {
    "locale": "en-US",
    "text": "Controller Remapping"
  },
  "summary": "Crimson Desert system reference: Controller Remapping. Gameplay support is limited to the linked claims and patch records.",
  "aliases": [
    {
      "locale": "en-US",
      "text": "Controller remap"
    }
  ],
  "tags": [
    "accessibility",
    "controls"
  ],
  "provenance": {
    "created_at": "2026-07-14T00:00:00-05:00",
    "created_by": "seed_import_v1",
    "source_receipt_id": "rcp_m1publicscope202609100001"
  }
}
